{
  "schema_version": "2026-09-08.task-context-manifest-v2",
  "task_id": "TASK-MWBV2-AGENT-RUNTIME-DESIGN-GUIDANCE-20260916",
  "task_ref": "tasks/TASK-MWBV2-AGENT-RUNTIME-DESIGN-GUIDANCE-20260916.md",
  "status": "completed",
  "created_at": "2026-09-16T07:51:36+00:00",
  "updated_at": "2026-09-16T07:53:46+00:00",
  "base_revision": "55a5394babf363f15c3156d69fdeae0e5acc2982",
  "baseline_dirty_files": {},
  "domains": [
    "control"
  ],
  "read_order": [
    "AGENTS.md",
    "project.state.json",
    "tasks/TASK-MWBV2-AGENT-RUNTIME-DESIGN-GUIDANCE-20260916.md",
    "tasks-context-manifests/TASK-MWBV2-AGENT-RUNTIME-DESIGN-GUIDANCE-20260916.json",
    "docs/Solution Design.md",
    "docs/Agent项目从零开发-人机协作经验图谱.md#7-最小文档与推进机制",
    "docs/project-现在的逻辑图.md#1-唯一闭环与真值分工",
    "docs/project-数据与报表契约.md#1-六层数据流"
  ],
  "reference_only": [
    {
      "ref": "/Users/hys/knowledge/01-个人本地知识库/03-人机协作与方法论/1-human-AI/人-agent分类及理解方法论v1.md",
      "reason": "用户指定的分类及选型方法参考；主要使用第 2、6、7 节，非当前项目运行真值，不采用其中近期产品公告作为新增结论。"
    }
  ],
  "allowed_writes": [
    "tasks/TASK-MWBV2-AGENT-RUNTIME-DESIGN-GUIDANCE-20260916.md",
    "tasks-context-manifests/TASK-MWBV2-AGENT-RUNTIME-DESIGN-GUIDANCE-20260916.json",
    "project.state.json",
    "evidence/TASK-MWBV2-AGENT-RUNTIME-DESIGN-GUIDANCE-20260916/**",
    "docs/Agent项目从零开发-人机协作经验图谱.md",
    "docs/Solution Design.md"
  ],
  "forbidden_actions": [
    "修改知识库原文、业务代码、数据库、API、平台状态、运行规则或 guardrails",
    "新增平行架构说明或重跑历史业务"
  ],
  "stop_conditions": [
    "发现并行任务或文件冲突、需要超出文档范围的变更、或无法由参考方法及当前合同支持新增表述时停止相关操作并报告"
  ],
  "open_gaps": [],
  "validation_plan": [
    {
      "acceptance_id": "AC-01",
      "command": "Python 对比基线章节、统计可见汉字净增及两张表行数；人工核对五类运行设计和推进顺序"
    },
    {
      "acceptance_id": "AC-02",
      "command": "对照参考方法第 2/6/7 节及当前合同进行四场景静态审阅；Python 核验变更引用及锚点"
    },
    {
      "acceptance_id": "AC-03",
      "command": "npm run check:project -- --phase start；git diff --check；Python 比较基线 guardrails 与 Git 变更范围"
    }
  ],
  "validation_results": [
    {
      "acceptance_id": "AC-01",
      "status": "passed",
      "command": "Python 对比基线章节、统计可见汉字净增及两张表行数；人工核对五类运行设计和推进顺序",
      "verified_at": "2026-09-16T07:53:25+00:00",
      "summary": "第 7 节净增 600 汉字，八项表与四行选型表齐全，五类设计问题及推进顺序已核对；前六节不变。",
      "evidence_refs": [
        "evidence/TASK-MWBV2-AGENT-RUNTIME-DESIGN-GUIDANCE-20260916/static-audit.json",
        "evidence/TASK-MWBV2-AGENT-RUNTIME-DESIGN-GUIDANCE-20260916/review.md"
      ]
    },
    {
      "acceptance_id": "AC-02",
      "status": "passed",
      "command": "对照参考方法第 2/6/7 节及当前合同进行四场景静态审阅；Python 核验变更引用及锚点",
      "verified_at": "2026-09-16T07:53:25+00:00",
      "summary": "四类场景静态审阅通过，开发与运行职责明确，按需建设边界完整；17 个引用及锚点核验有效。",
      "evidence_refs": [
        "evidence/TASK-MWBV2-AGENT-RUNTIME-DESIGN-GUIDANCE-20260916/static-audit.json",
        "evidence/TASK-MWBV2-AGENT-RUNTIME-DESIGN-GUIDANCE-20260916/review.md"
      ]
    },
    {
      "acceptance_id": "AC-03",
      "status": "passed",
      "command": "npm run check:project -- --phase start；git diff --check；Python 比较基线 guardrails 与 Git 变更范围",
      "verified_at": "2026-09-16T07:53:25+00:00",
      "summary": "启动及 Git 空白检查通过，修改范围符合合同，guardrails 和业务实现不变。",
      "evidence_refs": [
        "evidence/TASK-MWBV2-AGENT-RUNTIME-DESIGN-GUIDANCE-20260916/start.json",
        "evidence/TASK-MWBV2-AGENT-RUNTIME-DESIGN-GUIDANCE-20260916/static-audit.json",
        "evidence/TASK-MWBV2-AGENT-RUNTIME-DESIGN-GUIDANCE-20260916/review.md"
      ]
    }
  ],
  "documentation_updates": [
    {
      "ref": "docs/Solution Design.md",
      "status": "updated",
      "reason": "更新经验复盘决策：保留骨架，按场景补运行设计，关联本次批准任务。"
    },
    {
      "ref": "docs/Agent项目从零开发-人机协作经验图谱.md",
      "status": "updated",
      "reason": "仅第 7 节补运行设计与条件选型，原前六节保留。"
    },
    {
      "ref": "AGENTS.md",
      "status": "not_needed",
      "reason": "本次解释开发与运行职责，现行协议及全局边界不变。"
    },
    {
      "ref": "docs/project-现在的逻辑图.md",
      "status": "not_needed",
      "reason": "仅引用其职责，不修改当前流程和运行合同。"
    },
    {
      "ref": "docs/project-数据与报表契约.md",
      "status": "not_needed",
      "reason": "方法文档讨论通用状态职责，不新增当前表/状态或报表规则。"
    },
    {
      "ref": "docs/project-lessons.md",
      "status": "not_needed",
      "reason": "方法参考的适用性补充，无新增跨任务实测结论。"
    }
  ],
  "temporary_authorizations": [],
  "result": {
    "summary": "在统一八项文档骨架内补充产品运行设计、四行架构起点和可叠加能力，净增 600 汉字。",
    "side_effects": "仅文档与任务协调记录变更，无业务代码、数据库、API、平台状态或运行机制修改。",
    "remaining_risks": [],
    "business_evidence_refs": []
  },
  "closed_at": "2026-09-16T07:53:46+00:00"
}
